{"inputs":{"master_ru":{"bytes":122946,"path":"outputs/21-master-ru-candidate/artifacts/MASTER_RU.md","sha256":"904133D5057172C404D28F3BCF2A5E4C578304A59382512D1B31FC56AE0FDAB2"},"master_ru_acceptance":{"bytes":1126,"path":"acceptance/master_ru.acceptance.json","sha256":"648307536F72A08463F77964EA501EA44BD3130602D01FC814ABD96B30EAC12D"},"master_ru_asset_manifest":{"bytes":4160,"path":"outputs/21-master-ru-candidate/artifacts/ASSET_MANIFEST.json","sha256":"A12565F3B3EC1BE3047C9E660438275E857E1371C502557ABC27EAA18E3B56AD"},"reconstruction_inventory":{"bytes":1097,"path":"upstream/RECONSTRUCTION_INVENTORY.json","sha256":"B37142B8CFB0E85A9BFF157E1DF435D24EDEE13E1F6B755B064E2108CF4E1547"},"source_identity":{"bytes":803,"path":"upstream/SOURCE_IDENTITY.json","sha256":"17EA15D089FDFA672620529CAB9883E025208CF33938819A0D87F29422004432"},"source_pdf":{"bytes":2915268,"path":"source/Call_of_Cthulhu_Miskatonic_Repository_Modern_Number_7_Dream_2021.pdf","sha256":"C03AD05644C5B7438E4FAB750557EB8098E637492242D21969C5C4110FBF97D0"}},"output_root":"artview-build","render":{"dpi":200,"format":"png"},"scenario_id":"number-7-dream","schema":"kb_creator.scenario_artview_profile.v4"}
